{
  "env": "production",
  "mqtt": {
    "broker_url": "mqtt://localhost:1883"
  },
  "backend": {
    "url": "http://10.3.121.1:4000",
    "port": 4000
  },
  "influxdb": {
    "url": "http://localhost:8086",
    "org": "tb",
    "token": "my-super-secret-admin-token-for-exhibition-tb-project"
  },
  "grafana": {
    "url": "http://10.3.121.1:3000"
  },
  "logging": {
    "level": "warn",
    "dir": "./logs"
  }
}
